title,publish_time,source,content,processed_at
7499元起！ 余承东“全国人民买得起”的新手机，为何风评两极分化？,2025年03月21日 08:51,新浪科技,"文 | 新浪科技 张俊 3月20日，余承东预热数月的“新形态手机”终于揭晓。 这是一款屏幕比例为16：10的阔折叠手机，引发了网友们两极分化的评论，尤其是7499元起的售价，似乎并不符合余承东所言的“全国人民都买得起”。他在发布会后表示，华为商城特推出12个月免息分期的优惠购机服务，以此回应网友们的关切。 吊足胃口的阔折叠，评价两极分化 这次发布会，外界最为关注的是余承东一直预热的“新形态手机”。 预热的次数有多频繁？早在2024年12月，他就发布视频称：“2025年，我们还会有大家想不到的产品”；今年1月，他在直播时主动爆料称，华为即将发布一款“全国人民都买得起的、意想不到的产品”；今年2月，他再次剧透，这款产品将是第一款为“原生鸿蒙”而生的新形态手机。 发布会之前，被吊足胃口的消费者对新形态手机进行了多种猜想。比如四折叠屏手机、超薄云手机、卷轴屏手机、可旋转屏幕的小折叠手机等等。而3月20日答案揭晓，是一款屏幕比例为16：10的阔折叠手机，命名为华为Pura X。 不过，网友们对华为Pura X的评价呈现出两极分化。有人认为确实兼具手机和平板两者的优势；但也有网友认为，华为Pura X并不符合多轮预热的预期，“就这？”刷屏。 其实，新手机的争议大概有两点： 是否属于新形态？简单来说，华为Pura X相当于把此前的小折叠手机，在屏幕宽度上做宽，或者是把大折叠手机旋转90度，在产品惊艳度上不如此前的三折叠手机； 二、是否属于全国人民都买得起？售价7499元起，在华为的折叠屏手机产品线中可能并不属于特别昂贵，但与同行其它的小折叠手机价格相比，并不便宜。 值得注意的是，发布会后，余承东专门发布视频称，为了让更多消费者体验到全球首款阔折叠，华为商城特推出12个月免息分期的优惠购机服务，每月仅需600元即可解锁不一样的阔感体验。 在外界看来，这样的“服务”，是对“不便宜”的一种间接回应。 Windows到期了，鸿蒙电脑要来了 除了新形态，此次华为Pura X还是首款全面搭载HarmonyOS 5的手机。 余承东表示，HarmonyOS 5底层重构更流畅，采用鸿蒙内核、方舟引擎、端云协同，整机性能提升40%。接下来，鸿蒙生态全面冲刺，主流应用鸿蒙化提供极致体验，暂未鸿蒙化的长尾应用可通过小程序获取。不过，还是有一些主流应用的鸿蒙版功能还不够完善，比如微信、抖音等。余承东坦言，鸿蒙版微信核心功能现在还有一些缺失，但很快就会补上去。据他透露，鸿蒙版微信今年3月底将上线“微信运动”“收藏”“视频号转发朋友圈”等功能，鸿蒙版抖音商城也将于3月底上线。 华为还公布了HarmonyOS 5机型升级名单，将于2025年第二季度开启多款机型的HarmonyOS 5.0.1推送升级计划，包括华为Mate 70 系列、华为Mate 60系列、华为Mate X6系列、华为MatePad Pro 13.2英寸系列等。此外，2025年3月底，华为nova 13系列、华为nova 12系列将开启HarmonyOS 5公测，华为MatePad Pro 13.2英寸2025、华为MatePad Pro 12.2英寸等多款机型将开启花粉Beta。 余承东还公布了一个更重磅的消息，他表示，华为终端全面进入鸿蒙时代，今年5月将推出鸿蒙电脑。 实际上，此前外界就有传闻称，本月微软Windows操作系统对华为的供货许可将到期，之后华为PC只能采用全国产化方案，即推出采用国产芯片+国产操作系统的PC产品。 据知情人士向新浪科技透露，鸿蒙电脑将搭载首个全栈自主可控的国产电脑操作系统——鸿蒙操作系统，从内核到应用全栈自研，重构电脑体验。鸿蒙电脑将通过鸿蒙打造面向未来的全球操作系统，打破传统电脑与移动设备的边界，带来软硬芯云垂直整合的流畅体验，自主可控的安全体验，以及小艺的智能体验等。据悉，当前鸿蒙电脑已能满足大多数的个人办公场景。 多款新车价格下调，刘亦菲来代言 除了新形态手机之外，本场发布会的另一大看点就是鸿蒙智行的多款新车亮相。 首先是问界的旗舰产品2025款问界M9，这款车型在外观、座椅、通信、激光投影、智驾等方面进行了升级。售价方面，五座版本售价46.98万元起，六座版本售价47.98万元起，这个定价相比前代基本保持不变。 其次是问界新M5 Ultra，这款车型在外观配色、内饰、底盘、智驾等方面进行了升级。售价22.98万元起，这不仅比此前23.8万元起预售价便宜了近1万元，更是比2024款的24.98万元的起售价便宜了2万元。 另外，余承东透露，问界M8将于4月发布，目前小订量超7万台。 这次发布会，余承东可以说一口气为问界预热或发布了三款产品。当前，赛力斯(127.930, 0.61, 0.48%)也确实亟需新品拉升销量，今年1月和2月，赛力斯的产销量连续两个月同比大幅下滑，这三款新品也有望为其销量注入新的动力。 除了与赛力斯合作的问界，与北汽合作的享界，以及与奇瑞合作的智界，在这次发布会上也得到了重点宣传。 此次享界推出了享界S9增程版，搭载华为雪鸮智能增程系统，最新华为途灵平台，最新华为ADS 3.3，升级4颗激光雷达。但预售价格仅为31.8万元起，而2024款享界S9纯电版的起售价为39.98万元起，这意味着享界S9增程版比纯电版便宜了8万多元。 至于智界，余承东透露，轿跑SUV智界R7大定已突破8万台。发布会上，他还官宣刘亦菲成为鸿蒙智行智界品牌大使，并诚邀智界车主参加4月17日智界品牌之夜，和刘亦菲面对面。3月24日刘亦菲还将在《今天我做东》栏目与余承东对话。 此前，外界还一度传出余承东与刘亦菲的绯闻，此次官宣代言人，可谓让智界赚足了流量。那么问题来了，余承东此前宣传还没见过刘亦菲，是真的吗？ .appendQr_normal 海量资讯、精准解读，尽在新浪财经APP 责任",2025-03-21 10:50:57.145848
直击AWE | 机器人成顶流，“宇树们”帮各厂家带货,2025年03月21日 08:43,新浪科技,"文 丨 新浪科技 周文猛 又是一年中国家电及消费电子博览会（AWE 2025），又到了各大家电品牌发新品、秀肌肉，抢夺用户注意力的关键时刻。 逛遍整个AWE展馆，新浪科技发现，本次AWE主要有两个最为核心的特色：第一，人形机器人(19.770, -0.30, -1.49%)进入家庭场景，正在成为各家竞相布局的对象。很多厂商都加入了机器人元素，并帮助招揽客源；第二，几乎所有家电，大到空调彩电小到扫地机，都融入了AI元素，“无人家务”的时代，即将开启。 宇树们现身“带货” AWE 2025展会现场，以人形机器人为代表的一系列机器人产品，也正在逐渐走入家庭场景，有望成为未来家庭当中的“AI管家”。 展会现场，今年以来备受关注的宇树G1机器人现身海信家电(30.050, -0.54, -1.77%)展馆，向观众们挥手致意并握手拍照，时不时还双手比画起“太极”武术动作，并为海信的家电产品“打卡带货”。不过遗憾的是，由于未能搭载专业的武术训练模型，该机器人并未表演其备受关注的“回旋踢”“侧空翻”等高难度动作。 而在海尔智家(27.680, -0.46, -1.63%)展台上，海尔智家最新剧透的家庭服务机器人“小星”也首次亮相，现场表演了打太极、原地踏步、向观众招手等动作，吸引了大群观展人围观，帮海尔“吸粉”。据悉，这是一款由海尔联合星动纪元共同打造的家庭场景小秘书，手掌拥有12个自由度，能够执行复杂任务，奔跑速度达到3.6m/s。 在追觅科技展台，由公司孵化公司——魔法原子打造的人形机器人小麦，也作为公司“多元化”发展的一份子来到现场，展示了追觅机器人产品的“科技质感”，让扫地机器人等产品也沾光不少。据悉，该人形机器人将于今年正式投入工厂进行生产，后续也将覆盖至家庭场景。 而仅旗下工业技术事业群参加本次AWE的美的集团(75.170, -1.34, -1.75%)，也在大会前夕放出了“正在研发人形机器人本体及相关核心零部件”的消息，而且样机视频也已流出，据悉目前已进入内部测试阶段。 虽然，目前人形机器人的运动性能和整体成本距离进入家庭场景还有一段时间，但从长的时间维度来看，人形机器人所具备的通用化场景泛化能力，以及更加“类人”的亲和力，让其未来走入家庭场景打下了良好基础。在扫地机器人、擦窗机器人等产品已经正式走入家庭场景的当下，距离人形机器人走入家庭场景的那天，或许也已经不远了。 “人形机器人硬件本体经过过去10年的发展，其实已经磨合到一个非常好的状态了，先不说成本，从表演中国功夫、跳舞以及抗揍等运动表现性能来看，也已经表现出了非常出色的硬件性能，到这个节点上，人形机器人进入家庭或者爆火出圈，其实也能够理解。”鼎晖百孚高级合伙人王晨在与新浪科技沟通中表示。 在她看来，人形机器作为通用性最强的一种机器人形态，有可能是整个机器人产业的终极形态，它的出现并不是一个“伪需求”，而是真的具有价值和需求的。 “无人家务”时代来了吗？ 本届AWE，除了展会主题被定为“AI科技，AI生活外”外，各大家电厂商，也铆足了劲儿呼应展会主题，竞相秀出自家的AI能力。 展会现场，海尔智家展出了公司最新推出的“AI之眼”，让智能家电实现了从“看见”到“看懂”的突破。据介绍，拥有“AI之眼”的海尔冰箱，能“看”见每种食材的存储情况，根据食材特性给出具体的保鲜方案，及时提醒用户取用食材避免过期，并提供个性化饮食搭配方案，减少食物浪费。 同样，搭载“AI之眼”的烟机，在发现要溢锅时也能指挥燃气灶调整火力，会“看锅”也能“控火”，用户即便短暂离开，也无需担心安全问题。 而在格力空调展区，格力AI动态节能科技系列产品——家用空调、挂机、中央空调等，通过搭载格力自主研发的专用芯片和AI人工智能算法，也实现了不限时长、不限季节、不限温度、不限风速、不限风向真省电。 在TCL展区，TCL小蓝翼空调通过毫米波雷达精准捕捉并识别用户睡眠状态，能通过AI算法实现睡眠曲线的自学习和自适应，实现高精度的温度控制，为用户打造最佳入睡AI新风，同时还集成了AI智慧语音、AI智省电等能力。 此外，在海信、长虹等家电企业以及华为、索尼、三星等消费电子企业展台，AI技术也成了展台上的“主角”。 海尔集团副总裁、海尔智家研发平台总经理舒海告诉新浪科技：“今天，大概80%的家务已经被家电代劳了，下一步，无人家务正在成为每一个消费者同时也是每个家电企业新的期待。”伴随AI让家电能够看清、看懂这个世界后，家电行业朝着行业向“无人家务”时代，又迈出了关键一步。 另一位AWE参展商代表同样对新浪科技感慨道：“AI确实是最亮眼的点，而且已经切实落地到家电产品上，能够去使用了，海尔、海信、TCL这些家电品牌新出的产品，都已经具备了AI能力，虽然个别功能还存在局限，但按照这个大趋势卷下去，我们从家务中解放双手的‘无人家务’时代马上就要到了”。 .appendQr_normal 海量资讯、精准解读，尽在新浪财经APP 责任",2025-03-21 10:50:57.145848
新龙移动发布2024年度业绩 年度溢利981.7万港元同比增加8.96%,2025年03月21日 08:39,新浪港股,". .hqimg_related .hqimg_related .hqimg_related .hqimg_related .to_page .hqimg_related .hqimg_related 热点栏目 自选股 数据中心 行情中心 资金流向 模拟交易 客户端 新龙移动(0.345, 0.00, 0.00%)（01362）发布截至2024年12月31日止年度业绩，该集团期内取得收益17.17亿港元，同比减少11.29%；年度溢利981.7万港元，同比增加8.96%；每股基本盈利3.51港仙。 公告称，年内，在行业逆境及消费者需求不断转变下，收益下降11%。然而，透过优化营运效益及策略性地专注于较高利润产品，集团的毛利率有所改善。更重要的是，集团致力推动可持续盈利，使权益拥有人应占纯利增加9%，凸显集团业务基础的强大优势。 .appendQr_normal 海量资讯、精准解读，尽在新浪财经APP 责任",2025-03-21 10:50:57.145848
中国移动拟续聘毕马威华振和毕马威为2025年度核数师,2025年03月21日 08:38,新浪港股,". .hqimg_related .hqimg_related .hqimg_related .hqimg_related .to_page .hqimg_related .hqimg_related 热点栏目 自选股 数据中心 行情中心 资金流向 模拟交易 客户端 中国移动(83.7, -1.00, -1.18%)（00941）发布公告，该公司拟继续聘用毕马威华振会计师事务所（特殊普通合伙）和毕马威会计师事务所为公司2025年度核数师。本事项尚需提交公司股东大会审议通过。 .appendQr_normal 海量资讯、精准解读，尽在新浪财经APP 责任",2025-03-21 10:50:57.145848
