title,publish_time,source,content,processed_at
隔夜要闻：美股收跌 原油走高 特朗普精简教育部 苹果调整AI管理层 小摩美称股上半年不会再创新高,2025年03月21日 06:39,环球市场播报,"function ft_articletoptg_scrollto(){ let ft_tg_el = document.getElementById('app-qihuo-kaihu-qr'); if(ft_tg_el){ let ft_tg_el_offtop = ft_tg_el.offsetTop - 100; window.scrollTo({ top: ft_tg_el_offtop, behavior: 'smooth' }); } } 欲览更多环球财经资讯，请移步7×24小时实时财经新闻 市场 收盘：美股小幅收跌 市场关注经济数据与货币政策前景 3月20日美股成交额前20：拼多多财报强劲股价上涨4% 周四热门中概股普跌 阿里巴巴跌4.39%，小鹏汽车跌7.27% 美国WTI原油周四收高1.6% 美国首次制裁海外“茶壶”炼油厂 纽约期金周四涨约0.4% 创历史新高后一度转跌 欧股主要指数收盘普跌 德国DAX30指数跌1.36% 宏观 美上周初请失业金人数略有上升 但裁员数据总体上仍处低位 美国2月领先经济指标进一步下滑 消费者悲观情绪拖累 特朗普说“很快”将与乌克兰签订稀土协议 上任两个月 特朗普正式签署行政令精简美教育部 泽连斯基坚守核电站控制权 但对美国投资持开放态度 加拿大总理卡尼或在本周末要求解散议会 提前举行大选 美客机翻覆事故报告公布：飞机下降过快导致起落架部件断裂和右翼脱落 公司 英伟达CEO黄仁勋：将开设量子计算实验室 苹果调整人工智能部门高管层 力争扭转Siri的开发困境 马斯克：特斯拉门店已加强安保 美司法部长：参与对特斯拉纵火袭击事件 3名美国人面临指控 美光科技本财季营收展望强劲 受人工智能产品需求推动 Perplexity AI正在商谈以180亿美元估值融资 慕尼黑再保险斥资26亿美元全资收购Next Insurance 加码美国中小企险赛道 礼来减肥药登陆印度 瑞银据悉考虑搬迁总部 以免瑞士提高资本金要求 特斯拉召回46000辆Cybertruck，称外部面板可能增加“撞车风险” 苹果流媒体业务据称每年亏损超10亿美元 评论 “新债王”Gundlach：美国经济陷入衰退的概率高于50% 摩根士丹利策略师Wilson：美股今年上半年不会再创新高了 不确定性加剧，英国央行提高暂停降息的可能性 英伟达CEO黄仁勋夸赞特朗普政策 前财长萨默斯：美联储大幅放缓缩表的决定拉响警报 揭示了债市脆弱性 英国央行维持利率不变 全球不确定性加剧下警告“降息节奏不宜过快” 特斯拉最大多头预警：马斯克必须调整战略 公司已陷危机 唯有创始人回归可破局 摩根大通：美国家庭对股票投资程度空前，正扭曲市场估值 欧洲央行管委Knot：对4月是否降息持开放态度 重大决议之夜，全球金融市场震动 贝尔德仍看空特斯拉 法国央行行长：欧洲央行有进一步降息的空间 纽约汇市：美元上涨 英国央行按兵不动后英镑下跌 美国债市：国债涨跌互现、短债走高 收益率曲线持续陡化 原油：油价上涨 美国加大对伊朗原油的制裁力度 欧洲债市：英国国债下跌、收益率曲线趋平 英国央行维持利率不变 .app-kaihu-qr .app-kaihu-qr 新浪合作大平台期货开户 安全快捷有保障 .appendQr_normal 海量资讯、精准解读，尽在新浪财经APP 责任",2025-03-21 10:50:56.882584
摩根士丹利策略师Wilson：美股今年上半年不会再创新高了,2025年03月21日 06:37,环球市场播报,"摩根士丹利(120.47, 0.62, 0.52%)的Michael Wilson表示，2025年困扰华尔街的美股剧烈波动可能至少持续到今年下半年，股价预计将维持在上个月触及的高点之下。 该公司的首席美股策略师预计，鉴于企业和经济增长前景笼罩在不确定性之下，任何近期的上涨都是暂时的，并且涨势由低质量的公司引领。 “我的最佳猜测是这将是滚动式复苏，”Wilson周四在接受采访时表示，“我们认为今年上半年不太可能再创新高。”但他补充说随着投资者将注意力转向2026年，股市在2025年下半年再创纪录高位是有可能的。 摩根士丹利首席美国股票策略师兼首席投资官Mike Wilson表示，美国股市可能在今年下半年创下新高。 “也许没有特朗普看跌期权，但美联储还在，”Wilson说，“如果我们的经济增长确实更糟，我认为他们会迅速做出反应。” 这位策略师建议投资者采取防御性投资策略，重点关注预期收益大幅调整的公司。他特别建议买入金融、软件、消费者服务以及媒体和娱乐板块的股票。相比之下，资产负债表状况不佳的低质量公司引领了市场近期的缓解性上涨。 与此同时，Wilson认为欧洲相对于美国的跑赢势头正在消退。该地区公司报告的盈利调整看起来弱于美国的公司。 “就回升交易而言，我相较于欧洲市场更看好标普500指数，”他说。 .appendQr_normal 海量资讯、精准解读，尽在新浪财经APP 责任",2025-03-21 10:50:56.882584
纽约期金周四涨约0.4% 创历史新高后一度转跌,2025年03月21日 06:27,环球市场播报,周四（3月20日）纽约尾盘，现货黄金跌0.08%，报3045.38美元/盎司，北京时间12：45涨至3057.49美元创历史新高，随后回吐涨幅并转跌，18：36刷新日低至3025.78美元。 COMEX黄金期货涨0.39%，报3053.20美元/盎司，09：20涨至3065.20美元创历史新高，随后转而在18：40跌至3032.80美元刷新日低。 现货白银跌0.63%，报33.5835美元/盎司。 COMEX白银期货跌0.29%，报34.105美元/盎司。 COMEX铜期货涨0.26%，报5.1135美元/磅。 .appendQr_normal 海量资讯、精准解读，尽在新浪财经APP 责任,2025-03-21 10:50:56.882584
特朗普说“很快”将与乌克兰签订稀土协议,2025年03月21日 06:04,环球市场播报,美国总统特朗普表示，他将很快与乌克兰签署一项自然资源协议，能从未来的开采收入中分一杯羹。 “我们正在做的事情之一是很快就与乌克兰签署稀土协议，” 特朗普周四在白宫的一个教育活动上说。 然而就在一天前，特朗普的发言人还表示美国正跳出此前与基辅磋商的矿产交易协议，并将重点转向更广泛的俄乌和约。 “我们现在专注于一项长期的和平协议，” 白宫新闻秘书Karoline Leavitt周三说，“我们已经超越了单纯的经济矿产交易框架。” 上月末特朗普与乌克兰总统沃洛迪米尔·泽连斯基在椭圆形办公室公开争吵后双方的矿产谈判无果而终。 .appendQr_normal 海量资讯、精准解读，尽在新浪财经APP 责任,2025-03-21 10:50:56.882584
纽约汇市：美元上涨 英国央行按兵不动后英镑下跌,2025年03月21日 06:01,环球市场播报,美元兑大多数G-10货币走高，投资者为4月2日这一关税起征日做准备。在英国央行维持利率不变后，英镑维持跌势。 彭博美元指数上涨0.3%，扩大前一交易日的涨幅，两日涨幅创2月28日以来最大。 “投资者可能正在为季末以及4月2日的关税风险做准备，”Jefferies全球外汇主管表示，“他们可能在削减持仓，因为本季度的主要交易是做空美元”。 美国总统特朗普表示，美联储应该降息；在官员评估关税举措带给经济的成本之际，他与美联储的观点出现分歧。 欧元/美元下跌0.5%至1.0853，为周五以来最低；一周风险逆转升至37个基点，看跌期权高于看涨期权，对欧元的看跌情绪达到3月3日以来最强。 欧洲央行行长拉加德称，由于围绕贸易问题的不可预测性上升，央行无法对利率做出坚定承诺。 英镑/美元跌0.3%至1.2965 英国央行货币政策委员会以8比1的票数决定将基准政策利率维持在4.5%不变，偏好持谨慎态度的决策者比经济学家预期的要多。 利率指引表明，全球经济前景暗淡尚未影响英国央行“渐进且谨慎”放松政策的计划。 野村经济学家Andrzej Szczepaniak、George Buckley和Josie Anderson在报告中写道，“我们仍然认为货币政策委员会所说的‘渐进’意味着每季度降息，‘谨慎’暗示利率路径并非自动模式。因此，要在5月份进行下一次降息，并落实我们对到2026年初合计降息100个基点的预期，需要有通胀明显下降的证据”。 美元/瑞典克朗上涨0.2%至10.1260 瑞典央行将基准利率维持在两年低点不变，并重申宽松周期已结束。 澳元/美元跌0.9%至0.6303 澳大利亚就业人数2月份意外下降，导致澳元和国债收益率走低，因交易员提高了对今年进一步降息的押注。 新西兰元/美元下跌近1%至0.5759 新西兰元周四在G-10货币中表现垫底。 美元/加元小幅走低，报1.4320；加拿大总理卡尼可能会在本周末要求解散议会；知情人士称，卡尼倾向于将选举日期定在4月28日。 美元/瑞郎涨0.5%至0.8820，瑞士央行将利率下调至2022年9月以来低点，以阻止投资者将大量资金投向瑞士法郎。 .appendQr_normal 海量资讯、精准解读，尽在新浪财经APP 责任,2025-03-21 10:50:56.882584
