title,publish_time,source,content,processed_at
特朗普呼吁最高法院终结禁制令频发并给体制“纠偏”,2025年03月21日 06:54,环球市场播报,美国总统特朗普呼吁结束全国范围内禁制令频发的状况，他在社交媒体上发帖要求最高法院“为这种有害且前所未见的局面纠偏”。 .appendQr_normal 海量资讯、精准解读，尽在新浪财经APP 责任,2025-03-21 10:50:56.913466
北京去年数字经济增加值 同比增长7.7%,2025年03月21日 06:51,媒体滚动,"来源：北京商报 3月20日，北京市统计局、国家统计局北京调查总队发布《北京市2024年国民经济和社会发展统计公报》（以下简称《公报》）。据悉，2024年，北京经济运行呈现“稳、进、优”三个特点，显现出北京经济较强的发展韧性与潜力。其中，加快建设全球数字经济标杆城市，按现价计算，全市数字经济增加值比上年增长7.7%。新兴产业加快发展，代表新质生产力发展方向的战略性新兴产业增加值比上年增长5.7%（按现价计算），占地区生产总值的比重为25.1%，比上年提高0.1个百分点。 经济实力稳步提升 据北京市统计局、国家统计局北京调查总队相关负责人介绍，在“稳”方面，2024年北京经济规模稳步扩大，全年实现地区生产总值49843.1亿元，按不变价格计算，比上年增长5.2%。按常住人口计算，全市人均地区生产总值达到22.8万元，保持全国省级地区最优水平。就业、物价形势总体稳定，居民消费价格比上年上涨0.1%。 在“进”方面，重点行业支撑带动，全年信息传输、软件和信息技术服务业，金融业，工业对经济增长的贡献突出，信息传输、软件和信息技术服务业为首要支柱行业。有效需求持续释放，反映实物工作量的建筑安装工程投资以及企业扩大生产能力的设备购置投资占固定资产投资的比重合计达到58.3%；服务性消费在文旅消费需求活跃带动下增长6.1%，与升级类消费相关的金银珠宝类、体育娱乐用品类等商品零售额分别增长15.9%和3.1%。 在“优”方面，新兴产业加快发展，代表新质生产力发展方向的战略性新兴产业增加值比上年增长5.7%（按现价计算），占地区生产总值的比重为25.1%，比上年提高0.1个百分点。发展活力不断增强，全年新设企业26.5万户；规模以上工业企业、服务业企业收入利润率分别为6.5%和22.3%，分别比上年提高0.4个和3.7个百分点。宏观政策落地显效，在“两重”“两新”政策支持带动下，全市基础设施投资增长17.7%，设备购置投资增长32.1%；限额以上批发和零售业中，家用电器及音像器材类商品零售额增长9.5%，新能源汽车零售额增长22.6%。 中国企业资本联盟副理事长柏文喜对北京商报记者表示，未来，战略性新兴产业将继续保持较快增长，对北京经济增长的贡献率将进一步提高。随着技术的不断突破和应用场景的拓展，新兴产业有望成为北京经济高质量发展的核心驱动力(9.320, -0.43, -4.41%)。 高质量发展蓄力向新 《公报》显示，北京新兴动能积蓄成势。加快建设全球数字经济标杆城市，按现价计算，全市数字经济增加值比上年增长7.7%，其中，数字经济核心产业增加值增长10.1%。高技术产业、战略性新兴产业（二者有交叉）分别实现增加值14932.1亿元和12530.2亿元，按现价计算，分别增长6.4%和5.7%，占地区生产总值的比重分别为30%和25.1%，分别比上年提高0.4个和0.1个百分点。高技术产业投资增长37.2%，其中，高技术制造业、高技术服务业投资分别增长50.8%和30%。 在国际科技创新中心与全球数字经济标杆城市建设加速的同时，国际消费中心城市培育建设扎实推进。消费市场不断扩容升级，2024年全年新增17家大型商业设施，商业面积超150万平方米；新引进首店960家，比上年增加14家；截至2024年末离境退税商店达到1147家，稳居全国首位。新消费模式成长迅速，全市限额以上批发和零售业、住宿和餐饮业网上零售额占社会消费品零售总额的比重超过四成，即时零售模式发展势头较好，便利店、超市、仓储会员店等业态通过公共网络合计实现的零售额增长9.4%，比上年提高4.9个百分点。 此外，京津冀协同发展迈出新步伐。据悉，2024年，疏解提质一般制造业企业104家，城市副中心建设连续五年保持千亿投资规模，副中心站综合交通枢纽主体工程完工，北京安贞医院通州院区开诊运行。协同创新和产业协作持续深化，北京流向津冀技术合同成交额843.7亿元，比上年增长12.7%，成功申创集成电路、新一代信息技术应用创新等5个国家先进制造业集群。加强生态环境联建联防联治，深化医教合作，更加紧密的发展格局逐步形成。 民生福祉不断增进 根据《公报》，居民收入稳步增加。2024年全市居民人均可支配收入85415元，比上年增长4.5%。城乡居民人均可支配收入比值为2.32，连续七年呈缩小态势。民生保障扎实稳固。全市一般公共预算支出中，教育、社会保障和就业、卫生健康支出合计占比近四成。住房保障力度不断加大，全年建设筹集保障性租赁住房7.1万套（间），竣工各类保障性住房8.3万套（间）；全市老旧小区改造新开工742个、新完工548个。2024年末参加企业职工基本养老、失业和工伤保险的人数分别比上年末增加27.9万人、19万人和24.2万人。 公共服务提质扩面，2024年末医疗卫生机构实有床位14.1万张、卫生技术人员34.5万人，分别比上年增加0.2万张和0.2万人。2024年末共有幼儿园2019所，增加28所，适龄儿童入园率和普惠率均达到93%。2024年末累计建成养老助餐点2410家，覆盖面扩展至6539个城乡社区、453万余人。2024年末公共图书馆总流通3274.4万人次，增长73.9%。全年共有352家表演场所举办演出57243场，增长15.6%。全年改扩建体育公园16个，新建或更新足球、篮球等体育健身活动场所340处。 市民出行更加绿色。2024年末轨道交通运营线路29条，比上年末增加2条；运营线路长度879公里，增加43公里；运营车辆7708辆，增加196辆；全年客运总量36.2亿人次，增长4.9%。2024年末新能源载客汽车保有量为64.2万辆，比上年末增加11.4万辆；共有共享单车94.7万辆，增加3.1万辆。 北京市统计局、国家统计局北京调查总队相关负责人表示，2025年，北京将持续扩内需、促改革、稳预期、防风险、补短板，加快培育和发展新质生产力，持续保障和改善民生福祉，推动首都高质量发展再上新台阶。 北京商报记者 卢扬 程靓 .appendQr_normal 海量资讯、精准解读，尽在新浪财经APP 责任",2025-03-21 10:50:56.913466
昨夜今晨国际财经热点一览_2025年3月21日_财经新闻,2025年03月21日 06:40,环球市场播报,欲览更多环球财经资讯，请移步7×24小时实时财经新闻 市场 收盘：美股小幅收跌 市场关注经济数据与货币政策前景 3月20日美股成交额前20：拼多多财报强劲股价上涨4% 周四热门中概股普跌 阿里巴巴跌4.39%，小鹏汽车跌7.27% 美国WTI原油周四收高1.6% 美国首次制裁海外“茶壶”炼油厂 纽约期金周四涨约0.4% 创历史新高后一度转跌 欧股主要指数收盘普跌 德国DAX30指数跌1.36% 宏观 美上周初请失业金人数略有上升 但裁员数据总体上仍处低位 美国2月领先经济指标进一步下滑 消费者悲观情绪拖累 特朗普说“很快”将与乌克兰签订稀土协议 上任两个月 特朗普正式签署行政令精简美教育部 泽连斯基坚守核电站控制权 但对美国投资持开放态度 加拿大总理卡尼或在本周末要求解散议会 提前举行大选 美客机翻覆事故报告公布：飞机下降过快导致起落架部件断裂和右翼脱落 公司 英伟达CEO黄仁勋：将开设量子计算实验室 苹果调整人工智能部门高管层 力争扭转Siri的开发困境 马斯克：特斯拉门店已加强安保 美司法部长：参与对特斯拉纵火袭击事件 3名美国人面临指控 美光科技本财季营收展望强劲 受人工智能产品需求推动 Perplexity AI正在商谈以180亿美元估值融资 慕尼黑再保险斥资26亿美元全资收购Next Insurance 加码美国中小企险赛道 礼来减肥药登陆印度 瑞银据悉考虑搬迁总部 以免瑞士提高资本金要求 特斯拉召回46000辆Cybertruck，称外部面板可能增加“撞车风险” 苹果流媒体业务据称每年亏损超10亿美元 评论 “新债王”Gundlach：美国经济陷入衰退的概率高于50% 摩根士丹利策略师Wilson：美股今年上半年不会再创新高了 不确定性加剧，英国央行提高暂停降息的可能性 英伟达CEO黄仁勋夸赞特朗普政策 前财长萨默斯：美联储大幅放缓缩表的决定拉响警报 揭示了债市脆弱性 英国央行维持利率不变 全球不确定性加剧下警告“降息节奏不宜过快” 特斯拉最大多头预警：马斯克必须调整战略 公司已陷危机 唯有创始人回归可破局 摩根大通：美国家庭对股票投资程度空前，正扭曲市场估值 欧洲央行管委Knot：对4月是否降息持开放态度 重大决议之夜，全球金融市场震动 贝尔德仍看空特斯拉 法国央行行长：欧洲央行有进一步降息的空间 纽约汇市：美元上涨 英国央行按兵不动后英镑下跌 美国债市：国债涨跌互现、短债走高 收益率曲线持续陡化 原油：油价上涨 美国加大对伊朗原油的制裁力度 欧洲债市：英国国债下跌、收益率曲线趋平 英国央行维持利率不变 .appendQr_normal 海量资讯、精准解读，尽在新浪财经APP 责任,2025-03-21 10:50:56.913466
隔夜要闻：美股收跌 原油走高 特朗普精简教育部 苹果调整AI管理层 小摩美称股上半年不会再创新高,2025年03月21日 06:39,环球市场播报,"function ft_articletoptg_scrollto(){ let ft_tg_el = document.getElementById('app-qihuo-kaihu-qr'); if(ft_tg_el){ let ft_tg_el_offtop = ft_tg_el.offsetTop - 100; window.scrollTo({ top: ft_tg_el_offtop, behavior: 'smooth' }); } } 欲览更多环球财经资讯，请移步7×24小时实时财经新闻 市场 收盘：美股小幅收跌 市场关注经济数据与货币政策前景 3月20日美股成交额前20：拼多多财报强劲股价上涨4% 周四热门中概股普跌 阿里巴巴跌4.39%，小鹏汽车跌7.27% 美国WTI原油周四收高1.6% 美国首次制裁海外“茶壶”炼油厂 纽约期金周四涨约0.4% 创历史新高后一度转跌 欧股主要指数收盘普跌 德国DAX30指数跌1.36% 宏观 美上周初请失业金人数略有上升 但裁员数据总体上仍处低位 美国2月领先经济指标进一步下滑 消费者悲观情绪拖累 特朗普说“很快”将与乌克兰签订稀土协议 上任两个月 特朗普正式签署行政令精简美教育部 泽连斯基坚守核电站控制权 但对美国投资持开放态度 加拿大总理卡尼或在本周末要求解散议会 提前举行大选 美客机翻覆事故报告公布：飞机下降过快导致起落架部件断裂和右翼脱落 公司 英伟达CEO黄仁勋：将开设量子计算实验室 苹果调整人工智能部门高管层 力争扭转Siri的开发困境 马斯克：特斯拉门店已加强安保 美司法部长：参与对特斯拉纵火袭击事件 3名美国人面临指控 美光科技本财季营收展望强劲 受人工智能产品需求推动 Perplexity AI正在商谈以180亿美元估值融资 慕尼黑再保险斥资26亿美元全资收购Next Insurance 加码美国中小企险赛道 礼来减肥药登陆印度 瑞银据悉考虑搬迁总部 以免瑞士提高资本金要求 特斯拉召回46000辆Cybertruck，称外部面板可能增加“撞车风险” 苹果流媒体业务据称每年亏损超10亿美元 评论 “新债王”Gundlach：美国经济陷入衰退的概率高于50% 摩根士丹利策略师Wilson：美股今年上半年不会再创新高了 不确定性加剧，英国央行提高暂停降息的可能性 英伟达CEO黄仁勋夸赞特朗普政策 前财长萨默斯：美联储大幅放缓缩表的决定拉响警报 揭示了债市脆弱性 英国央行维持利率不变 全球不确定性加剧下警告“降息节奏不宜过快” 特斯拉最大多头预警：马斯克必须调整战略 公司已陷危机 唯有创始人回归可破局 摩根大通：美国家庭对股票投资程度空前，正扭曲市场估值 欧洲央行管委Knot：对4月是否降息持开放态度 重大决议之夜，全球金融市场震动 贝尔德仍看空特斯拉 法国央行行长：欧洲央行有进一步降息的空间 纽约汇市：美元上涨 英国央行按兵不动后英镑下跌 美国债市：国债涨跌互现、短债走高 收益率曲线持续陡化 原油：油价上涨 美国加大对伊朗原油的制裁力度 欧洲债市：英国国债下跌、收益率曲线趋平 英国央行维持利率不变 .app-kaihu-qr .app-kaihu-qr 新浪合作大平台期货开户 安全快捷有保障 .appendQr_normal 海量资讯、精准解读，尽在新浪财经APP 责任",2025-03-21 10:50:56.913466
摩根士丹利策略师Wilson：美股今年上半年不会再创新高了,2025年03月21日 06:37,环球市场播报,"摩根士丹利(120.47, 0.62, 0.52%)的Michael Wilson表示，2025年困扰华尔街的美股剧烈波动可能至少持续到今年下半年，股价预计将维持在上个月触及的高点之下。 该公司的首席美股策略师预计，鉴于企业和经济增长前景笼罩在不确定性之下，任何近期的上涨都是暂时的，并且涨势由低质量的公司引领。 “我的最佳猜测是这将是滚动式复苏，”Wilson周四在接受采访时表示，“我们认为今年上半年不太可能再创新高。”但他补充说随着投资者将注意力转向2026年，股市在2025年下半年再创纪录高位是有可能的。 摩根士丹利首席美国股票策略师兼首席投资官Mike Wilson表示，美国股市可能在今年下半年创下新高。 “也许没有特朗普看跌期权，但美联储还在，”Wilson说，“如果我们的经济增长确实更糟，我认为他们会迅速做出反应。” 这位策略师建议投资者采取防御性投资策略，重点关注预期收益大幅调整的公司。他特别建议买入金融、软件、消费者服务以及媒体和娱乐板块的股票。相比之下，资产负债表状况不佳的低质量公司引领了市场近期的缓解性上涨。 与此同时，Wilson认为欧洲相对于美国的跑赢势头正在消退。该地区公司报告的盈利调整看起来弱于美国的公司。 “就回升交易而言，我相较于欧洲市场更看好标普500指数，”他说。 .appendQr_normal 海量资讯、精准解读，尽在新浪财经APP 责任",2025-03-21 10:50:56.913466
