title,publish_time,source,content,processed_at
光大期货：3月21日软商品日报,2025年03月21日 09:32,市场资讯,". .hqimg_related .hqimg_related .hqimg_related .hqimg_related .to_page .hqimg_related .hqimg_related 热点栏目 自选股 数据中心 行情中心 资金流向 模拟交易 客户端 白糖(6128, -19.00, -0.31%)： 昨日原糖期价再次上行，主力合约收于19.96美分/磅。广西制糖集团报价6130~6260元/吨，下调10元/吨；云南制糖集团报价5970~6010元/吨，下调10元/吨。据海关总署数据，2025年1月、2月我国进口糖浆、白砂糖预混粉（税则号列170290）数量分别为7.21万吨、1.81万吨，同比分别下降2.62万吨、5.19万吨。2024/25榨季截至2月，全国累计进口170290项下三类商品共72.32万吨，同比增长13.95万吨，增幅23.91%。原糖方面仍围绕印度估产、巴西能否按时开榨争论不休，5月合约交割前预计仍将维持偏强格局，关注巴西开榨情况。国内盘面刷新前期高点，距离6200元/吨整数关口只有一步之遥，关注该位置的压力情况，短期期价有望维持强势，但未来继续上行需有进一步利好支撑，注意持仓风险。 棉花(14690, -40.00, -0.27%)： 周四，ICE美棉下跌0.44%，报收66.06美分/磅，CF505上涨0.59%，报收13690元/吨，新疆地区棉花到厂价为14612元/吨，较前一日上涨7元/吨，中国棉花价格指数3128B级为14891元/吨，较前一日上涨17元/吨。国际市场方面，宏观层面仍是近期市场关注重点，美联储3月议息会议按兵不动，符合市场预期，但鲍威尔讲话强调对经济不确定性担忧，表示将放缓缩表进程。点阵图显示年内降息次数仍大概率是两次。预计后续仍有阶段性扰动。除宏观外，后续关注会更多在于新棉种植情况。国内市场方面，郑棉期价仍维持窄幅震荡走势。基本面来看，目前郑棉供需两端均缺乏趋势性驱动，预计短期仍维持震荡走势，国内新棉即将开始种植，后续关注新棉种植及天气扰动。 免责声明 本报告的信息均来源于公开资料，我公司对这些信息的准确性、可靠性和完整性不作任何保证，也不保证所包含的信息和建议不会发生任何变更。我们已力求报告内容的客观、公正，但文中的观点、结论和建议仅供参考，并不构成任何具体产品、业务的推介以及相关品种的操作依据和建议，投资者据此作出的任何投资决策自负盈亏，与本公司和作者无关。 .app-kaihu-qr .app-kaihu-qr 新浪合作平台光大期货开户 安全快捷有保障 .appendQr_normal 海量资讯、精准解读，尽在新浪财经APP 责任",2025-03-21 10:50:57.245578
华致酒行：目前已与麦德龙、沃尔玛等大型商超建立合作,2025年03月21日 09:32,酒业内参,"近日，有投资者在互动平台提问，华致酒行(17.380, -0.05, -0.29%)与各大品牌超市和饭店是否有深度合作？胖东来、同庆楼(22.330, -0.04, -0.18%)等。 对此，华致酒行表示，公司目前已与麦德龙、沃尔玛等大型商超建立合作。 华致酒行2024年度业绩预告显示，预计归属于上市公司股东的净利润为3807万元至5150万元，同比下降83.82%至78.11%。数据显示，2024年前三季度华致酒行归母净利润为1.68亿元，这意味着公司第四季度或亏损1.165亿元至1.299亿元。 值得注意的是，自去年下半年以来，华致酒行进行了两次分红，合计4.9亿元。而2019年至2023年该公司分红总和约4.5亿元。股权信息显示，华致酒行实际控制人吴向东持股63.47%，这意味着近两次大额分红大部分流入其口袋。 .appendQr_normal 海量资讯、精准解读，尽在新浪财经APP 责任",2025-03-21 10:50:57.245578
光大期货：3月21日有色金属日报,2025年03月21日 09:32,市场资讯,"铜： 隔夜LME铜下跌0.88%至9910美元/吨；沪铜(78500, -860.00, -1.08%)主力下跌0.05%至81230元/吨；国内现货进口亏损约700元/吨。宏观方面，美联储3月议息会议同意继续暂停降息，将目标政策利率区间维持在4.25%-4.5%，符合市场预期，本次会议对经济和就业的描述缓解了市场对于近期美国经济数据放缓的担忧，但从金融市场反馈来看仍需要更明确的数据支撑。会后特朗普喊话美联储要求降息。库存方面，LME库存下降1900吨至223275吨；comex铜增加114.31吨至84623.06吨；SMM全国主流地区铜库存周四统计较周一下降0.26万吨至34.64万吨，较上周四下降0.91万吨，实现连续3周周度去库。COMEX铜表现坚挺，Comex与LME价差继续走阔，说明市场正定价美对铜进口关税从10%到25%的可能性，同时带动了内外铜价走高。对于国内来说，在内外关税政策不确定（美调查铜贸易）及内外大幅倒挂和去库背景下，并不适合做空，如刚果（金）冲突消息以及国内铜精矿紧张情绪，多头加大了对供给端不稳定性的押注。短线仍宜偏强看待，但也不宜中线持仓。 镍&不锈钢： 隔夜LME镍跌1.22%报16215美元/吨，沪镍(131810, -1740.00, -1.30%)跌0.18%报130080元/吨。库存方面，昨日LME镍库存减少894吨至200436吨，国内 SHFE 仓单增加525吨至28522吨。升贴水来看，LME0-3 月升贴水维持负数；进口镍升贴水维持-50元/吨。不锈钢方面，据Mysteel，周内全国主流市场不锈钢89仓库口径社会总库存1，121，521吨，周环比减0.48%。300系方面，不锈钢库存总量757，812吨，周环比减0.16%。新能源方面，原料端价格扰动叠加需求环比好转，带动硫酸镍价格走强。市场实际仍是处过剩格局且需求相对疲软，建议关注国内库存情况来考虑国内基本面变化，关注短线逢高沽空机会，若或回调至成本线附近结合基本面考虑逢低做多，警惕海外政策调整。 氧化铝&电解铝： 氧化铝震荡偏强，隔夜AO2505收于3027元/吨，涨幅1.17%，持仓增仓4350手至21.9万手。沪铝(19740, -155.00, -0.78%)震荡偏强，隔夜AL2504收于20840元/吨，涨幅0.02%。持仓减仓727手至24.6万手。现货方面，SMM氧化铝价格继续回调至3182元/吨。铝锭现货贴水收至40元/吨，佛山A00报价回落至20800元/吨，对无锡A00贴水30元/吨，下游铝棒加工费包头河南临沂持稳，新疆南昌广东下调60-100元/吨；铝杆1A60加工费持稳，6/8系加工费持稳，低碳铝杆加工费上调210元/吨。氧化铝当前处于供需边际增速博弈阶段，近月延续弱稳，远月受成本支撑更强。关注矿端发运和下游补库节奏，警惕成本下方位置出现超跌修复。美国关税政策反复再度引发市场避险情绪，光伏抢装热度旺盛，以旧换新政策带动需求增量明显，电解铝延续偏强，当前两万一上方仍有阻力，可考虑下方逢低轻仓试多。 锡： 沪锡(273650, 500.00, 0.18%)主力涨0.76%，报281120元/吨，锡期货仓单8290吨，较前一日减少463吨。LME锡涨1.42%，报35345美元/吨。锡库存3810吨，持平。现货市场，对2503云锡升水700-1000元/吨，交割升水200-600元/吨，小牌贴水300元/吨到平水，进口贴水700-800元/吨。价差方面，04-05价差-500元/吨，05-06价差+30元/吨，沪伦比7.95。M23最后时刻拒绝参与和谈，刚果金局势仍不稳，Bisie或短期复产无望。中期来看，锡价走势仍将偏强，前期多单仍可持有，但需注意Bisie矿山停产时间不确定性较高，需密切关注矿山消息与当地冲突进展。 锌： 沪锌(23735, -630.00, -2.59%)主力涨0.34%，报23840元/吨，锌期货仓单19495吨，较前一日减少900吨。LME锌跌0.29%，报2919.0美元/吨，锌库存155225吨，减少925吨。现货市场，上海0#锌对2504合约升水0-20元/吨，对均价升水0-20元/吨；广东0#锌对沪锌2504合约贴水5元/吨，粤市较沪市贴水40元/吨；天津0#锌对沪锌2504合约贴水20到升水50元/吨，津市较沪市贴水10元/吨。价差方面，04-05价差+0元/吨，05-06价差+55元/吨，沪伦比8.17。国内供需两增，而且在锌价震荡回升下，国内锌库存累库较少，总体锌供需较为平稳，但由于下游库存较低，低价备货意愿较好，如果价格回暖可能会继续带动库存去化，所以锌价可能呈现震荡走势。海外随着澳洲锌厂减产，市场开始担心低Benchmark会导致欧洲和亚洲冶炼企业减产。由于国内冶炼产能过剩，海外冶炼减产会让海外矿快速流入国内，当前矿进口目前亏损，后续或通过美金锌矿加工费反弹的方式来让进口窗口打开，锌内外反套建议观望。 工业硅&多晶硅： 20日多晶硅震荡偏强，主力2506收于43695元/吨，日内涨幅1.05%，持仓减仓459手至28956手；SMM多晶硅N型硅料价格42000元/吨，现货对主力贴水扩至1695元/吨。工业硅震荡偏弱，主力2505收于9740元/吨，日内跌幅0.61%，持仓减仓4095手至25.3万手。百川工业硅现货参考价10792元/吨，较上一交易日下调45元/吨。最低交割品#553价格降至9850元/吨，现货升水扩至100元/吨。工业硅万元下方持续探底，暂未新疆大厂引发减产动作。下游多晶硅提产进度延迟，有机硅仍在减产，库存重压下工业硅延续探底，警惕大厂减产消息出现引发大幅反弹。多晶硅仍存高位支撑，阶段去库存稀释需求，限制上方空间。考虑逢低试多或联动工业硅跨品种套利，持续关注硅片排产节奏和政策推进情况。 碳酸锂： 昨日碳酸锂期货2505合约跌2.81%至73260元/吨。现货价格方面，电池级碳酸锂平均价下跌450元/吨至74450元/吨，工业级碳酸锂下跌4500元/吨至72500元/吨，电池级氢氧化锂（粗颗粒）下跌50元/吨至69800元/吨，电池级氢氧化锂（微粉）下跌50元/吨至75000元/吨。仓单方面，昨日仓单库增加1249吨至38081吨。碳酸锂周度产量环比减少454吨至17946吨，其中锂辉石和锂云母提锂环比下降，盐湖和回收提锂小幅增加，如若维持当前价格水平，后市或将需要下修3月产量预期；下游需求3月明显增加，磷酸铁锂+三元材料日均消耗碳酸锂环比增加7%；周度库存环比增加2764吨至126399吨，其中上下游延续增加，其他环节有所下降。目前尽管锂矿相对紧缺和锂矿价格倒挂，但参考mysteel2月锂矿发运数据来看，锂矿到港量预计将有增加，矿价近期亦有下调；在当前价格水平上游出货意愿下降，导致可流通的好货供应减少，但近期过期仓单陆续注销，或可成为补充，且需要注意客供/长协的增加导致下游采购活跃度降低；此外，仓单昨日重回增加态势。昨日价格破位下跌，当前的市场情况来看价格仍将偏弱运行，关注上游停减产情况，中期警惕下游的高库存消化不畅或带来的负反馈。 .app-kaihu-qr .app-kaihu-qr 新浪合作平台光大期货开户 安全快捷有保障 .appendQr_normal 海量资讯、精准解读，尽在新浪财经APP 责任",2025-03-21 10:50:57.245578
腾讯控股：2024年全年支付320亿港元现金股息并回购价值1120亿港元股票,2025年03月21日 09:29,市场资讯,来源：Gangtise投研 腾讯控股（00700.HK）2024年第四季度及全年业绩电话会：2024年，腾讯在业务发展、财务状况及AI领域均取得显著成果。核心业务方面，微信通过MiniShot和搜索升级增强交易能力，视频号用户时长快速增长，游戏业务常青游戏组合增至14个，腾讯视频多部剧集排名前列。财务上，全年营收增长率提升，第四季度营收同比增长11%，毛利同比增长17%，股东应占盈利按非IFRS计算增长显著，全年支付320亿港元现金股息并回购价值1120亿港元股票。AI领域，混元模型持续升级，多模态模型在图像、视频和3D生成方面表现突出，面向消费者的AI产品如元宝DAU增长迅猛，企业端AI业务整合加速，AI赋能广告、游戏等现有业务成效显著，2024年AI相关资本支出大增，为未来发展奠定基础。 .appendQr_normal 海量资讯、精准解读，尽在新浪财经APP 责任,2025-03-21 10:50:57.245578
光大期货：3月21日能源化工日报,2025年03月21日 09:28,市场资讯,". .hqimg_related .hqimg_related .hqimg_related .hqimg_related .to_page .hqimg_related .hqimg_related 热点栏目 自选股 数据中心 行情中心 资金流向 模拟交易 客户端 原油(607, -8.60, -1.40%)： 周四油价重心上移，其中WTI 4月合约收盘上涨1.10美元至68.26美元/桶，涨幅1.64%。布伦特5月合约收盘上涨1.22美元至72.00美元/桶，涨幅1.72%。SC2505以534.1元/桶收盘，上涨12.1元/桶，涨幅为2.32%。周四晚间美国公布伊朗有关的新制裁，制裁对象包括亚洲一家独立炼油厂，以及向这些炼油厂供应原油的船只。市场因此担忧伊朗原油运输路径被进一步跟踪和制裁，影响国内炼厂货物到货量，盘面整体表现SC更强于外盘。3月20日，OPEC+产油国同意按最新方案实施补偿性的减产。沙特、俄罗斯、伊拉克、阿联酋、科威特、哈萨克斯坦、阿曼递交了相关计划。月度补偿性减产意味着18.9-43.5万桶/日的减产幅度，OPEC+方面表示，新的补偿性减产计划将持续到2026年6月。从当前原油市场来看，地缘方面，美国对伊朗的极限施压来自各个维度，对制裁的实施也将是较为严格的，因而短期担忧供应端扰动的概率增加，从而对SC的定价也将是偏强影响。 燃料油(3495, -7.00, -0.20%)： 周四，上期所燃料油主力合约FU2505收涨0.77%，报3127元/吨；低硫燃料油主力合约LU2505收涨0.65%，报3583元/吨。截至3月17日当周，新加坡燃料油库存录得1961.8万桶，环比前一周增加170万桶（9.49%）；富查伊拉燃料油库存录得1103.9万桶，环比前一周增加128.7万桶（13.2%）。从基本面看，低硫燃料油市场持稳，高硫燃料油市场偏强运行。低硫方面，由于西半球低硫市场现货供应充足，且受巴西到港量增加影响，3月抵运至新加坡的套利货物环比将增加约50万吨左右，但是东西套利经济性下降将限制4月从西方流入新加坡的套利货数量。高硫方面，上周新加坡高硫市场结构进一步走强，显示现货依然偏紧，但是本周外盘贴水稍有回落，短期FU仍受影响较大，LU则维持震荡偏弱状态，需要注意短期油价波动风险。 沥青(3609, -13.00, -0.36%)： 周四，上期所沥青主力合约BU2506收涨1.41%，报3527元/吨。隆众资讯统计，本周国内沥青54家企业厂家样本出货量共35.6万吨，环比增加19.5%；本周国内改性沥青69家样本企业改性沥青产能利用率为3.0%，环比增加1.1%，同比减少0.5%。原料端受到美国对委内瑞拉制裁或收紧的影响，部分原料船货量有所减少，但预计不会对于沥青生产造成较大掣肘；需求端天气和资金影响仍然存在，从下游开工来看终端没有明显改善的迹象，炼厂出货量连续两周大幅下滑，显示出货压力较大。短期来看，沥青在供应增加和需求恢复较慢的压力之下库存累积的速度会进一步加快，绝对价格以偏空思路对待，或可考虑做空裂解利润。 橡胶(16955, 130.00, 0.77%)： 周四，截至日盘收盘沪胶主力RU2505上涨180元/吨至17045元/吨，NR主力上涨305元/吨至14730元/吨，丁二烯橡胶BR主力下跌170元/吨至13685元/吨。昨日上海全乳胶16600（+150），全乳-RU2505价差-225（+220），人民币混合16750（+200），人混-RU2505价差-75（+270），BR9000齐鲁现货13750（+0），BR9000-BR主力75（+125）。2025年1-2月中国合成橡胶累计产量为161.5万吨，同比增长15.3%。2025年1-2月中国外胎产量较上年同期增加4.6%至1.76504亿条。本周国内轮胎企业半钢胎开工负荷为82.74%，较上周小幅走低0.06个百分点，较去年同期走高2.74个百分点。本周山东轮胎企业全钢胎开工负荷为69.05%，较上周小幅走低0.04个百分点，较去年同期走低1.06个百分点。2025年1-2月份，进口天然及合成共142.4万吨，同比增23.3%，其中天胶进口增加17.6万吨，合成增长9.28万吨。进口分项数据混合胶进口不及预期，但其他胶种有所增加。进口总体仍保持增势，国内云南产区物候较好，正常时间点开割预期较强。下游轮胎需求维持稳定刚需，终端汽车产销稳定增长。供弱需稳下，胶价震荡偏弱，后续关注物候条件变化。 PX&PTA(5834, -4.00, -0.07%)&MEG： TA505昨日收盘在4856元/吨，收涨0.58%；现货报盘贴水05合约10元/吨。EG2505昨日收盘在4417元/吨，收跌0.63%，基差增加9元/吨至28元/吨，现货报价4450元/吨。PX期货主力合约501收盘在6846元/吨，收涨0.94%。现货商谈价格为839美元/吨，折人民币价格6939元/吨，基差走扩54元/吨至133元/吨。江浙涤丝产销整体偏弱，平均产销估算在3成左右。福建一套70万吨/年的MEG装置已于近日升温重启中，该装置此前于2月中下旬停车执行检修。华东一套120万吨PTA装置目前重启中，预计近日出产品，该装置3月上停车检修。陕西一套180万吨/年的合成气制乙二醇(4641, -57.00, -1.21%)装置其中部分产能计划于4月初起停车轮修，预计时间在35天左右。华东一年产55万吨聚酯瓶片装置近期重启升温中，预计本周末附近出产品。TA装置检修持续，需求表现现实弱预期强，基本面来看TA预期较好，在成本端原油止跌下，TA价格偏强震荡。乙二醇供应检修落实，需求预期恢复，库存累库增幅减弱下，存在底部震荡调整可能。关注乙二醇装置开工推迟，以及远期到港量超预期的可能。 甲醇(2529, -33.00, -1.29%)： 周四，太仓现货价格2693元/吨，内蒙古北线价格在2235元/吨，CFR中国价格在300-305美元/吨，CFR东南亚价格在365-370美元/吨。下游方面，山东地区甲醛价格1175元/吨，江苏地区醋酸价格2720-2800元/吨，山东地区MTBE价格5725元/吨。供应端由于甲醇生产企业利润良好，国内甲醇生产同比高位运行，但随着检修装置的逐步增加，后续将环比回落，海外供应目前同比下降，预计到港量也将维持低位。需求端随着MTO装置复产，以及传统下游开工缓慢回升，短期或维持稳定。综合来看，国内产量季节性下降，需求呈现稳中回升的态势，预计内地库存下降，而MTO装置开工高位将继续带动港口去库，但后续海外供应回归或利空盘面，预计甲醇价格维持震荡走势，关注海外装置变动对盘面的影响。 聚烯烃： 周四，全国拉丝均价在7325元/吨，较上周跌20元/吨，跌幅0.27%，利润方面，油制PP(7664, -18.00, -0.23%)毛利-196.6元/吨，煤制PP生产毛利744.4元/吨，甲醇制PP生产毛利-1196.67元/吨，丙烷脱氢制PP生产毛利-647.28元/吨，外采丙烯制PP生产毛利-235.5元/吨。PE方面，华北地区油制线型主流价格在7900元/吨，较上周价格-170元/吨；华东地区油制线型主流价格在8100元/吨，较上周价格-50元/吨；华南地区油制线型主流价格在8050元/吨，较上周价格-100元/吨；利润端，油制聚乙烯市场毛利为80元/吨；煤制聚乙烯市场毛利为1704元/吨。基本面方面，供应端维持在较高水平，但开始有部分炼厂检修，预计供应将维持小幅震荡，需求端下游开工恢复速度预计放缓，因此补库需求边际走弱，短期库存下降速度缓慢，价格或震荡偏弱。 聚氯乙烯： 周四，华东PVC(5886, 65.00, 1.12%)市场价格稳中上调，电石法5型料4810-4950元/吨，乙烯料主流参考5050-5300元/吨左右；华北PVC市场价格稳中暂稳，电石法5型料主流参考4830-4950元/吨左右，乙烯料主流参考5000-5240元/吨；华南PVC市场价格稳中下调，电石法5型料主流参考5020-5050元/吨左右，乙烯料主流报价在5100-5200元/吨。供应方面，炼厂并未开启大规模检修，短期仍在高位。需求方面，国内房地产施工快速回升，带动管材和型材开工率上涨，但后续增速将放缓，需求边际量走弱，出口在政策落地后，会阶段性走弱。综合来看，供给维持稳定而需求增速将放缓，后续去库压力较大，预计价格震荡偏弱。 尿素： 周四尿素期货价格上涨明显，主力合约收盘价1850元/吨，涨幅3.76%。现货市场继续上扬，各主流地区市场价格上调10~20元/吨，目前山东临沂地区市场价格1870元/吨，日环比涨20元/吨。基本面来看，尿素供应水平继续回落，昨日日产量已降至19.56万吨，但同比仍偏高。需求端跟进力度有所加强，昨日各主流地区现货产销率多数超过100%，部分地区产销超过180%，山东、河南稍显偏弱。整体来看，尿素市场情绪持续回暖，且旺季预期仍有望支撑盘面保持强势状态。不过目前距离大规模用肥尚需时日，高成交持续度有待进一步验证，再加上保供稳价政策导向，短期不建议过分追涨。关注尿素日产水平、现货成交持续力度。 纯碱： 周四纯碱期货价格震荡偏强，主力合约收盘价1431元/吨，涨幅1.2%。现货市场窄幅波动，沙河重碱价格小幅反弹至1416元/吨，日环比涨12元/吨。基本面来看，本周纯碱产量下降4%，企业库存下降2.73%，供应支撑力度进一步加强。需求有所波动，下游浮法玻璃(1439, -10.00, -0.69%)产能小幅下降，光伏玻璃产能小幅提升，纯碱刚需水平有所提升。但受制于下游囤货意愿不足，对原料采购情绪依旧偏谨慎。整体来看，纯碱供应支撑加强，但需求支撑力度有限，供需驱动稍显不足。预计期货盘面延续底部宽幅震荡趋势，后期供应提升市场或将再次承压。关注纯碱装置负荷变化、需求跟进力度及商品市场相关品种走势。 玻璃： 周四玻璃期货价格宽幅震荡，主力合约收盘价1173元/吨，微幅上涨0.34%。现货市场价格维稳，昨日国内浮法玻璃市场均价稳定在1263元/吨。昨日玻璃在产产能继续稳定在15.85万吨，供应端对市场驱动不强。近期现货成交氛围持续好转，昨日主流地区玻璃产销率均突破100%以上，提振厂家挺价心态同时带动玻璃厂开始去库。本周玻璃企业库存下降1.13%至6946.0万重箱，成为春节后首次去库。需要注意的是当前产业心态信心依旧不足，现货成交持续度有待进一步观察。整体来看，玻璃现货情绪继续回暖，但产业链心态仍有分化，期货市场短期趋势性不明。后期在政策提振及小阳春共振下玻璃期价中枢仍存继续上移可能，关注政策落实力度、玻璃现货成交持续情况。 烧碱： 周四烧碱期货价格继续下行，主力合约收盘价2557元/吨，跌幅1.96%。现货市场继续下探，山东地区高浓度碱价格下调10~40元/吨。昨日山东32%液碱价格下调30元/吨至960元/吨，折合干吨价格3000元/吨。山东50%液碱价格下调20元/吨至1540元/吨，折合干吨价格3080元/吨。盘面持续下行后明显贴水现货，期货市场仓单压力缓解。基本面来看，本周烧碱行业产能利用率回落0.9个百分点，企业库存累积10.38%至45.97万吨（湿吨），压制市场心态及价格。需求端跟进力度有限，非铝下游观望情绪浓厚，主力下游送货量维持高位，进一步压制主力采购烧碱价格空间。整体来看，当前烧碱市场缺乏利好因素提振，盘面也将延续偏弱状态。关注盘面持续下跌后能否出现修复性反弹机会，另需关注主力下游送货量、烧碱基差修复情况。 .app-kaihu-qr .app-kaihu-qr 新浪合作平台光大期货开户 安全快捷有保障 .appendQr_normal 海量资讯、精准解读，尽在新浪财经APP 责任",2025-03-21 10:50:57.245578
