title,publish_time,source,content,processed_at
3月20日美股成交额前20：拼多多财报强劲股价上涨4%,2025年03月21日 05:10,环球市场播报,"周四美股成交额第1名英伟达收高0.86%，成交291.22亿美元。英伟达在3月18日宣布，正在波士顿建立一个研究中心，提供前沿技术，以推动量子计算发展。 英伟达加速量子研究中心（NVAQC）将整合领先的量子硬件与AI超级计算机，实现加速量子超级计算。NVAQC有助于解决量子计算领域最具挑战性的难题，涵盖从量子比特噪声到将实验性量子处理器转化为实用设备。Quantinuum、Quantum Machines和QuEra Computing等量子计算领域领先的创新企业将与NVAQC开展合作，通过与哈佛量子计划（HQI）和麻省理工学院（MIT）工程量子系统组（EQuS）等顶尖学术机构的研究人员展开深度协作，共同推进量子技术的发展。 第2名特斯拉(236.26, 0.40, 0.17%)收高0.17%，成交230.58亿美元。特斯拉公司周四宣布，由于发现车辆外部不锈钢饰板可能在行驶中脱落并造成安全隐患，将召回几乎所有未来感设计风格的Cybertruck电动皮卡。这是该车型自上市以来第八次召回行动。 此次召回涉及约4.6万辆汽车，涵盖从2023年11月13日（Cybertruck首台量产车下线日期）至今年2月27日期间生产的所有车辆。根据特斯拉周二向美国国家公路交通安全管理局（NHTSA）提交的报告，虽然该批次中仅约1%的车辆存在缺陷，但公司出于安全预防考虑决定全面召回。 报告显示，截至3月14日，特斯拉已发现151例可能与饰板问题相关的保修索赔，但公司强调“尚未获悉任何与该状况相关或可能相关的碰撞事故、人员伤亡报告”。 此外华尔街知名科技分析师、韦德布什证券（Wedbush）的丹·艾夫斯警告称，特斯拉已陷危机，马斯克必须调整战略，唯有创始人回归方可破局。 在特斯拉股价经历三个月惨烈下跌后，这位分析师指出，特斯拉CEO埃隆·马斯克必须重新专注于特斯拉的业务。他强调：“马斯克亟需改变当前路线……特斯拉的未来命悬于此”，并直言公司正经历“重大危机”，唯有创始人能够力挽狂澜。 第3名Meta Platforms收高0.33%，成交144.5亿美元。Meta Platforms公司周四表示，从本周开始，Meta AI人工智能聊天机器人将在41个欧洲国家和21个海外地区的WhatsApp、Facebook、Instagram和Messenger上推出，但目前仅限于基于文本的聊天功能。 第4名苹果(214.1, -1.14, -0.53%)收跌0.53%，成交103.61亿美元。知情人士透露，苹果公司正在对高管层进行罕见地调整，旨在让数月来波折连连的人工智能业务重回正轨。 首席执行官库克对人工智能部门负责人John Giannandrea的产品开发能力失去信心，因此让另一位高管，Vision Pro的创造者Mike Rockwell来负责此事。知情人士透露，Rockwell将负责Siri语音助手。 Rockwell将向软件主管Craig Federighi汇报工作，Siri将完全脱离Giannandrea的管辖范围，苹果势将在本周宣布人事变动。 此举凸显了苹果面临的困境，其人工智能技术严重落后于行业竞争对手，而且该公司几乎没有表现出迎头赶上的迹象。 第6名亚马逊(194.95, -0.59, -0.30%)收跌0.30%，成交75.96亿美元。亚马逊公司周四表示，已经开始向其供应商、商业客户和其他公司出售碳信用额，这些信用额可以用来抵消碳排放。此举正值企业、项目开发商和科学家就碳信用额度应该在多大程度上用于帮助企业减排以及如何确保信用额度的质量展开激烈辩论之际。该公司在一份声明中表示，包括Flickr、房地产咨询集团Seneca和消费电子公司Corsair在内的几家公司已经参与了该计划。 此外印度产品认证机构周四表示，在针对亚马逊和沃尔玛(85.81, -0.52, -0.60%)旗下Flipkart的仓库突袭检查中，发现二者均违反了印度质量控制规则，因为这两家公司的库存产品没有所需的标准证书。 第8名博通收跌2.28%，成交58.47亿美元。周四有报道称，由于博通HBM订单激增，SK海力士计划比原计划提前两个月在其新M15X工厂引入设备。设备交付原定于12月进行，现已提前至10月。 第10名谷歌(165.05, -1.23, -0.74%)A类股收跌0.67%，成交44.51亿美元。日前谷歌的母公司Alphabet提高报价，宣布以320亿美元收购云安全初创公司Wiz。此后高盛(562.68, 5.34, 0.96%)与瑞银(32.99, -0.08, -0.24%)发布了研报对该交易进行点评。 根据研报，高盛重申Alphabet“买入”评级和目标价220美元。瑞银维持Alphabet“中性”评级，并给予目标价209美元。这两家投行给出的目标价均高于谷歌此前的历史最高价206美元。 第12名拼多多(130.92, 5.00, 3.97%)收高3.97%，成交42.41亿美元。拼多多公布2024年第四季度及全年业绩，其中，第四季度总营收为1106.1亿元，同比增长24%；不按美国通用会计准则，归属于拼多多普通股股东的净利润为298.5亿元，同比增长17%。对于2024年全年，总营收为3938.361亿元，同比增长59%；不按美国通用会计准则，归属于拼多多普通股股东的净利润为1223.436亿元，同比增长80%。 拼多多集团董事长、联席CEO陈磊表示，2025年，拼多多将聚焦高质量发展战略，发挥平台的数字化优势，扩大“新质供给”的上行规模，持续推动产业带向新质阶段迈进，全力构建用户、商家及平台的共赢生态。 第15名埃森哲(300.91, -23.56, -7.26%)收跌7.26%，成交32.11亿美元。埃森哲公布了第二财季业绩。截至2月28日的第二财季，以美元计算的营收同比增长5%，至167亿美元，高于预期。GAAP每股收益同比增长7%，至2.82美元，略高于预期2.81美元。 展望未来，埃森哲预计第三财季营收将在169亿美元至175亿美元之间（中间值为172亿美元），而市场普遍预期为172.2亿美元。 埃森哲还警告称，埃隆·马斯克削减美国政府支出的举措已开始影响其收入。该公司CEO Julie Sweet在电话会上表示，“新政府有一个明确的目标——提高联邦政府的运行效率。在此过程中，许多新的采购行动已经放缓，对我们的销售和收入产生了负面影响。” 第16名阿里(136.91, -6.29, -4.39%)巴巴收跌4.39%，成交31.73亿美元。零一万物创始人兼CEO李开复日前公开表示，DeepSeek掀起的行业变革彻底颠覆了人工智能行业的发展模式，中国市场最终可能只剩下DeepSeek、阿里巴巴和字节跳动三家主要的AI模型公司，其中DeepSeek目前势头最强。 第20名Applovin收高3.27%，成交25.67亿美元。 （截图来自新浪财经APP 行情-美股-市场板块 左滑更多数据）下载新浪财经APP .appendQr_normal 海量资讯、精准解读，尽在新浪财经APP 责任SF065",2025-03-21 10:50:56.740972
美国债市：国债涨跌互现、短债走高 收益率曲线持续陡化,2025年03月21日 04:53,环球市场播报,美债在美联储议息会议后的趋陡势头在周四延续，日间国债涨跌互现。市场对美联储政策路径的押注更加明确地转向鸽派，曲线前端和腹部跑赢。长债略微跑输，收益率日间小幅走高。周四的价格动态缺乏新的催化剂，不过午后随着英国国债涨势消退、WTI期货扩大涨幅，对美国国债的买盘略有回落。 纽约下午3点过后不久，2年期国债收益率日间下跌2个基点，10年期国债收益率下跌1.5个基点，报约4.235%；英国央行维持利率不变并对通胀风险发出警告后，英国国债熊市趋平，英国债市尾盘的一些抛盘压力也拖累了美债。 5s30s利差日间扩大约2个基点，最高达到54.8个基点，低于上周触及的略高于59个基点的年度高点。 美联储会后市场的押注转向鸽派，为曲线的前端提供了支撑，如今市场押注FOMC到12月降息约66个基点，周三收盘时押注的降息幅度为62个基点；如今押注6月会议降息约20个基点，即降息25个基点的概率为80%。 WTI期货在美国尾盘上涨1.6%，仍接近盘中高点，这似乎帮助遏制了美国国债的进一步上涨。 截至纽约时间下午3：56，2年期国债收益率报3.9573%， 5年期国债收益率报4.0066%， 10年期国债收益率报4.2312%， 30年期国债收益率报4.5526%， 5年和30年期国债收益率报54.43个基点， 2年和10年期国债收益率报27.18个基点。 .appendQr_normal 海量资讯、精准解读，尽在新浪财经APP 责任,2025-03-21 10:50:56.740972
特朗普称美国和乌克兰很快将签署稀土协议,2025年03月21日 04:51,环球市场播报,美国总统特朗普在白宫发表讲话，他表示将很快与乌克兰就稀土问题签署协议。 .appendQr_normal 海量资讯、精准解读，尽在新浪财经APP 责任,2025-03-21 10:50:56.740972
特朗普签署有关解散美国教育部的命令,2025年03月21日 04:51,环球市场播报,美国总统特朗普在白宫签署有关解散美国教育部的命令。 .appendQr_normal 海量资讯、精准解读，尽在新浪财经APP 责任,2025-03-21 10:50:56.740972
原油：油价上涨 美国加大对伊朗原油的制裁力度,2025年03月21日 04:50,环球市场播报,"function ft_articletoptg_scrollto(){ let ft_tg_el = document.getElementById('app-qihuo-kaihu-qr'); if(ft_tg_el){ let ft_tg_el_offtop = ft_tg_el.offsetTop - 100; window.scrollTo({ top: ft_tg_el_offtop, behavior: 'smooth' }); } } 原油上涨，因为美国加大对伊朗原油的制裁力度，以施压德黑兰达成新核协议。 WTI上涨1.6%，两周多来首次收于每桶68美元上方。 全球基准布伦特原油攀升至每桶72美元。 美国总统特朗普在最近送达伊朗最高领袖阿里(136.91, -6.29, -4.39%)·哈梅内伊的信中表示，伊朗有两个月的期限来达成新的核协议。 “如果谈判失败，特朗普难免将对伊朗的出口造成重大影响，”CIBC Private Wealth Group的高级能源交易员Rebecca Babin表示。 尽管如此，由于利空因素导致价格承压，原油仍明显低于1月中旬的峰值。 虽然不断升级的贸易战可能削弱能源需求，但OPEC+将从4月开始增产，从而可能导致全球供应过剩。 周四到期的4月交割的WTI原油期货上涨1.6%，结算价报每桶68.26美元。 交投更为活跃的5月合约上涨1.7%，结算价报68.07美元。 5月布伦特原油上涨1.7%，结算价报每桶72美元。 .app-kaihu-qr .app-kaihu-qr 新浪合作大平台期货开户 安全快捷有保障 .appendQr_normal 海量资讯、精准解读，尽在新浪财经APP 责任",2025-03-21 10:50:56.740972
