title,publish_time,source,content,processed_at
昨夜今晨国际财经热点一览_2025年3月21日_财经新闻,2025年03月21日 06:40,环球市场播报,欲览更多环球财经资讯，请移步7×24小时实时财经新闻 市场 收盘：美股小幅收跌 市场关注经济数据与货币政策前景 3月20日美股成交额前20：拼多多财报强劲股价上涨4% 周四热门中概股普跌 阿里巴巴跌4.39%，小鹏汽车跌7.27% 美国WTI原油周四收高1.6% 美国首次制裁海外“茶壶”炼油厂 纽约期金周四涨约0.4% 创历史新高后一度转跌 欧股主要指数收盘普跌 德国DAX30指数跌1.36% 宏观 美上周初请失业金人数略有上升 但裁员数据总体上仍处低位 美国2月领先经济指标进一步下滑 消费者悲观情绪拖累 特朗普说“很快”将与乌克兰签订稀土协议 上任两个月 特朗普正式签署行政令精简美教育部 泽连斯基坚守核电站控制权 但对美国投资持开放态度 加拿大总理卡尼或在本周末要求解散议会 提前举行大选 美客机翻覆事故报告公布：飞机下降过快导致起落架部件断裂和右翼脱落 公司 英伟达CEO黄仁勋：将开设量子计算实验室 苹果调整人工智能部门高管层 力争扭转Siri的开发困境 马斯克：特斯拉门店已加强安保 美司法部长：参与对特斯拉纵火袭击事件 3名美国人面临指控 美光科技本财季营收展望强劲 受人工智能产品需求推动 Perplexity AI正在商谈以180亿美元估值融资 慕尼黑再保险斥资26亿美元全资收购Next Insurance 加码美国中小企险赛道 礼来减肥药登陆印度 瑞银据悉考虑搬迁总部 以免瑞士提高资本金要求 特斯拉召回46000辆Cybertruck，称外部面板可能增加“撞车风险” 苹果流媒体业务据称每年亏损超10亿美元 评论 “新债王”Gundlach：美国经济陷入衰退的概率高于50% 摩根士丹利策略师Wilson：美股今年上半年不会再创新高了 不确定性加剧，英国央行提高暂停降息的可能性 英伟达CEO黄仁勋夸赞特朗普政策 前财长萨默斯：美联储大幅放缓缩表的决定拉响警报 揭示了债市脆弱性 英国央行维持利率不变 全球不确定性加剧下警告“降息节奏不宜过快” 特斯拉最大多头预警：马斯克必须调整战略 公司已陷危机 唯有创始人回归可破局 摩根大通：美国家庭对股票投资程度空前，正扭曲市场估值 欧洲央行管委Knot：对4月是否降息持开放态度 重大决议之夜，全球金融市场震动 贝尔德仍看空特斯拉 法国央行行长：欧洲央行有进一步降息的空间 纽约汇市：美元上涨 英国央行按兵不动后英镑下跌 美国债市：国债涨跌互现、短债走高 收益率曲线持续陡化 原油：油价上涨 美国加大对伊朗原油的制裁力度 欧洲债市：英国国债下跌、收益率曲线趋平 英国央行维持利率不变 .appendQr_normal 海量资讯、精准解读，尽在新浪财经APP 责任,2025-03-21 10:50:56.907483
隔夜要闻：美股收跌 原油走高 特朗普精简教育部 苹果调整AI管理层 小摩美称股上半年不会再创新高,2025年03月21日 06:39,环球市场播报,"function ft_articletoptg_scrollto(){ let ft_tg_el = document.getElementById('app-qihuo-kaihu-qr'); if(ft_tg_el){ let ft_tg_el_offtop = ft_tg_el.offsetTop - 100; window.scrollTo({ top: ft_tg_el_offtop, behavior: 'smooth' }); } } 欲览更多环球财经资讯，请移步7×24小时实时财经新闻 市场 收盘：美股小幅收跌 市场关注经济数据与货币政策前景 3月20日美股成交额前20：拼多多财报强劲股价上涨4% 周四热门中概股普跌 阿里巴巴跌4.39%，小鹏汽车跌7.27% 美国WTI原油周四收高1.6% 美国首次制裁海外“茶壶”炼油厂 纽约期金周四涨约0.4% 创历史新高后一度转跌 欧股主要指数收盘普跌 德国DAX30指数跌1.36% 宏观 美上周初请失业金人数略有上升 但裁员数据总体上仍处低位 美国2月领先经济指标进一步下滑 消费者悲观情绪拖累 特朗普说“很快”将与乌克兰签订稀土协议 上任两个月 特朗普正式签署行政令精简美教育部 泽连斯基坚守核电站控制权 但对美国投资持开放态度 加拿大总理卡尼或在本周末要求解散议会 提前举行大选 美客机翻覆事故报告公布：飞机下降过快导致起落架部件断裂和右翼脱落 公司 英伟达CEO黄仁勋：将开设量子计算实验室 苹果调整人工智能部门高管层 力争扭转Siri的开发困境 马斯克：特斯拉门店已加强安保 美司法部长：参与对特斯拉纵火袭击事件 3名美国人面临指控 美光科技本财季营收展望强劲 受人工智能产品需求推动 Perplexity AI正在商谈以180亿美元估值融资 慕尼黑再保险斥资26亿美元全资收购Next Insurance 加码美国中小企险赛道 礼来减肥药登陆印度 瑞银据悉考虑搬迁总部 以免瑞士提高资本金要求 特斯拉召回46000辆Cybertruck，称外部面板可能增加“撞车风险” 苹果流媒体业务据称每年亏损超10亿美元 评论 “新债王”Gundlach：美国经济陷入衰退的概率高于50% 摩根士丹利策略师Wilson：美股今年上半年不会再创新高了 不确定性加剧，英国央行提高暂停降息的可能性 英伟达CEO黄仁勋夸赞特朗普政策 前财长萨默斯：美联储大幅放缓缩表的决定拉响警报 揭示了债市脆弱性 英国央行维持利率不变 全球不确定性加剧下警告“降息节奏不宜过快” 特斯拉最大多头预警：马斯克必须调整战略 公司已陷危机 唯有创始人回归可破局 摩根大通：美国家庭对股票投资程度空前，正扭曲市场估值 欧洲央行管委Knot：对4月是否降息持开放态度 重大决议之夜，全球金融市场震动 贝尔德仍看空特斯拉 法国央行行长：欧洲央行有进一步降息的空间 纽约汇市：美元上涨 英国央行按兵不动后英镑下跌 美国债市：国债涨跌互现、短债走高 收益率曲线持续陡化 原油：油价上涨 美国加大对伊朗原油的制裁力度 欧洲债市：英国国债下跌、收益率曲线趋平 英国央行维持利率不变 .app-kaihu-qr .app-kaihu-qr 新浪合作大平台期货开户 安全快捷有保障 .appendQr_normal 海量资讯、精准解读，尽在新浪财经APP 责任",2025-03-21 10:50:56.907483
摩根士丹利策略师Wilson：美股今年上半年不会再创新高了,2025年03月21日 06:37,环球市场播报,"摩根士丹利(120.47, 0.62, 0.52%)的Michael Wilson表示，2025年困扰华尔街的美股剧烈波动可能至少持续到今年下半年，股价预计将维持在上个月触及的高点之下。 该公司的首席美股策略师预计，鉴于企业和经济增长前景笼罩在不确定性之下，任何近期的上涨都是暂时的，并且涨势由低质量的公司引领。 “我的最佳猜测是这将是滚动式复苏，”Wilson周四在接受采访时表示，“我们认为今年上半年不太可能再创新高。”但他补充说随着投资者将注意力转向2026年，股市在2025年下半年再创纪录高位是有可能的。 摩根士丹利首席美国股票策略师兼首席投资官Mike Wilson表示，美国股市可能在今年下半年创下新高。 “也许没有特朗普看跌期权，但美联储还在，”Wilson说，“如果我们的经济增长确实更糟，我认为他们会迅速做出反应。” 这位策略师建议投资者采取防御性投资策略，重点关注预期收益大幅调整的公司。他特别建议买入金融、软件、消费者服务以及媒体和娱乐板块的股票。相比之下，资产负债表状况不佳的低质量公司引领了市场近期的缓解性上涨。 与此同时，Wilson认为欧洲相对于美国的跑赢势头正在消退。该地区公司报告的盈利调整看起来弱于美国的公司。 “就回升交易而言，我相较于欧洲市场更看好标普500指数，”他说。 .appendQr_normal 海量资讯、精准解读，尽在新浪财经APP 责任",2025-03-21 10:50:56.907483
纽约期金周四涨约0.4% 创历史新高后一度转跌,2025年03月21日 06:27,环球市场播报,周四（3月20日）纽约尾盘，现货黄金跌0.08%，报3045.38美元/盎司，北京时间12：45涨至3057.49美元创历史新高，随后回吐涨幅并转跌，18：36刷新日低至3025.78美元。 COMEX黄金期货涨0.39%，报3053.20美元/盎司，09：20涨至3065.20美元创历史新高，随后转而在18：40跌至3032.80美元刷新日低。 现货白银跌0.63%，报33.5835美元/盎司。 COMEX白银期货跌0.29%，报34.105美元/盎司。 COMEX铜期货涨0.26%，报5.1135美元/磅。 .appendQr_normal 海量资讯、精准解读，尽在新浪财经APP 责任,2025-03-21 10:50:56.907483
欧洲在掂量“向中国靠拢”,2025年03月21日 06:21,市场资讯,"参考消息 对欧洲人来说，由于担心跨大西洋(5.050, 0.15, 3.06%)联盟的日子可能屈指可数，因此引出一个不可回避的问题。 为弥补美国的不可靠，他们是否应尝试与中国建立更好的关系，尽管双方在地缘政治和贸易问题上存在深刻分歧？抑或，这种行为的风险太高？ 关于中国对欧洲的意图以及欧洲将如何应对，西方专家的看法各不相同：有些人持怀疑态度，另一些人则较为务实。 德国墨卡托中国研究所高级分析师格热戈日·斯特茨认为：“中国日益视欧洲为一个政治上分裂、地缘政治上面临挑战的角色，可以利用欧洲拓展其市场，并逐步建立多极化国际秩序。” 斯特茨表示：“循序渐进的过程将使中国有时间进一步加强其地缘政治地位。北京押注华盛顿对欧洲施加的压力将促使后者投入中国的怀抱，从而抵消跨大西洋的紧张关系。” 比利时国际危机研究组织专家阿里·怀恩同意这一观点。他说，中国在特朗普政府引发的世界秩序动荡中看到了机会。 “中国确实看到了一个战略机遇，尤其是在跨大西洋联盟出现裂痕的情况下。”怀恩说，“中国正在定位对欧盟的立场，并鼓励欧盟采取更多措施维护战略自主。” 然而，欧洲议会前顾问冯儒莎认为，中国与欧盟的接触将遇到障碍，“布鲁塞尔与北京之间多年的贸易争端等所导致的紧张关系将难以消除”。 与这些地缘政治摩擦密切相关的是欧洲与中国的贸易和投资关系。这一关系虽然广泛，但充满争端，欧洲方面存在焦虑。 据欧盟统计局统计，中国是欧盟的最大进口伙伴之一，但仅是第三大出口市场。 这种贸易失衡主要是因为中国相对于欧盟的竞争力在稳步上升。此外，欧盟和中国围绕关税存在摩擦，尽管其规模有限、破坏性较小。 一个重要的问题是，欧盟对中国制造的电动汽车征收的关税是否会对新兴的欧洲电动汽车行业有所帮助。 安东·斯皮萨克在为智库欧洲改革中心撰写的分析报告中提出，关税的好处可能并不多，“欧洲汽车制造商面临的结构性压力远远超过有补贴的进口汽车”。 对欧洲国家来说，它们往往很难在与中国的经济关系上形成统一战线，因为一些国家强大的商业部门严重依赖中国消费者和供应商。 德国就是一个很好的例子。贸易紧张关系并未阻止德国去年上半年对中国的投资飙升，其中很大一部分是由德国大型汽车制造商推动的。 我们也不应忘记英国最近为重建与中国的经济和金融关系所做的努力。欧洲对外关系委员会亚洲项目高级政策研究员曾楚希将这一举动描述为“向中国贸易和投资开放的高层政治信号”，它“与欧盟较为谨慎的立场形成鲜明对比”。 总而言之，与美国的裂痕将在中国问题上给欧洲带来一些艰难的选择。 本文由英国《金融时报》网站3月15日发表，原题为《欧洲应该向中国靠拢吗？》，作者是托尼·巴伯。 .appendQr_normal 海量资讯、精准解读，尽在新浪财经APP 责任",2025-03-21 10:50:56.907483
