title,publish_time,source,content,processed_at
天津发展：力生制药2024年度归母净利润1.85亿元 同比减少49%,2025年03月21日 07:54,新浪港股,". .hqimg_related .hqimg_related .hqimg_related .hqimg_related .to_page .hqimg_related .hqimg_related 热点栏目 自选股 数据中心 行情中心 资金流向 模拟交易 客户端 天津发展(2.1, -0.02, -0.94%)（00882）发布力生制药（002393.SZ）截至2024年12月31日止年度业绩，该公司营业收入为13.36亿元，同比增长15.88%。归属于上市公司股东的净利润为1.85亿元，同比减少49.00%。归属于上市公司股东的扣除非经常性损益的净利润为1.03亿元，同比减少31.16%。基本每股收益为0.72元。此外，拟向全体股东每10股派发现金红利3.5元（含税）。 .appendQr_normal 海量资讯、精准解读，尽在新浪财经APP 责任",2025-03-21 10:50:57.034143
阿仕特朗金融：给予某实体的贷款,2025年03月21日 07:52,新浪港股,". .hqimg_related .hqimg_related .hqimg_related .hqimg_related .to_page .hqimg_related .hqimg_related 热点栏目 自选股 数据中心 行情中心 资金流向 模拟交易 客户端 阿仕特朗金融(0.32, 0.01, 4.92%)（08333）发布公告，于2025年3月20日，贷款方A（公司间接全资附属公司）与贷款方B、贷款方C及借款方订立贷款融资协议，据此贷款方已同意，其唯一目的是为接受要约项下提呈的目标股份的付款拨资，而授予合计本金额不超过1.92亿港元的贷款融资。在该贷款融资中，贷款方A已同意向借款方提供本金额不超过8000万港元的贷款方A贷款融资，贷款方B已同意向借款方提供本金额不超过5000万港元的贷款方B贷款融资，及贷款方C已同意向借款方提供本金额不超过6200万港元的贷款方C贷款融资。 .appendQr_normal 海量资讯、精准解读，尽在新浪财经APP 责任",2025-03-21 10:50:57.034143
科济药业-B获北京神农投资管理股份有限公司增持2863.15万股 每股作价8.98港元,2025年03月21日 07:51,新浪港股,". .hqimg_related .hqimg_related .hqimg_related .hqimg_related .to_page .hqimg_related .hqimg_related 热点栏目 自选股 数据中心 行情中心 资金流向 模拟交易 客户端 香港联交所最新资料显示，3月18日，北京神农投资管理股份有限公司增持科济药业-B(12.22, -0.78, -6.00%)（02171）2863.15万股，每股作价为8.98港元，总金额约2.57亿港元。增持后最新持股数目约为2863.15万股，持股比例为5.01%。 .appendQr_normal 海量资讯、精准解读，尽在新浪财经APP 责任",2025-03-21 10:50:57.034143
扬科集团获非执行董事蔡朝晖增持1468万股 每股作价约0.23港元,2025年03月21日 07:50,新浪港股,". .hqimg_related .hqimg_related .hqimg_related .hqimg_related .to_page .hqimg_related .hqimg_related 热点栏目 自选股 数据中心 行情中心 资金流向 模拟交易 客户端 香港联交所最新资料显示，3月17日，副主席兼非执行董事蔡朝晖增持扬科集团(0.245, 0.00, 0.00%) （01460）1468万股，每股作价0.2303港元，总金额约为338.08万港元。增持后最新持股数目约为1.81亿股，最新持股比例为20.57%。 .appendQr_normal 海量资讯、精准解读，尽在新浪财经APP 责任",2025-03-21 10:50:57.034143
日本通胀四个月来首次放缓 受能源补贴恢复影响,2025年03月21日 07:48,环球市场播报,在政府补贴恢复降低公用事业成本之后，日本消费通胀四个月来首次放缓，这一结果支持了日本央行继续逐步加息的理由。 内务省周五公布的数据显示，2月份不包括生鲜食品的消费者价格指数同比增长3.0%，增速低于1月的3.2%。经济学家此前预期为增长2.9%。总体通货膨胀也有所放缓，从前月的4%下滑至3.7%。 该数据与东京的通胀报告基本一致，后者显示能源补贴导致通胀放缓。关键价格指标连续第35个月保持在或高于日本央行2%的目标水平。 .appendQr_normal 海量资讯、精准解读，尽在新浪财经APP 责任,2025-03-21 10:50:57.034143
