title,publish_time,source,content,processed_at
哪吒汽车宣布获泰国金融机构100亿泰铢授信，联席总裁章晓栋：各项自救举措有效推进中,2025年03月21日 15:55,新浪科技,"新浪科技讯 3月21日下午消息，哪吒汽车近日在泰国曼谷召开2025年泰国经销商大会。泰国国务院总理办公室副主任他纳廸-卉拉沙等政府官员，哪吒汽车党委书记、联席总裁章晓栋，助理总裁兼海外事业部常务副总裁孙光、泰国子公司总经理孙宝龙出席会议。 会议中，哪吒汽车党委书记、联席总裁章晓栋表示“公司的各项自救举措正在积极有效的推进中，供应商债转股效果明显，已为企业轻装上阵、更好的吸引外部投资奠定了重要的基础。”，还阐明了哪吒汽车下一阶段的战略规划：“当前，汽车行业正处在巨大的挑战和深刻的变革之中，哪吒汽车未来将双轮驱动，打造‘智能网联、自主可控、天地一体的新能源汽车主机厂’，同时转型成‘新型工业4.0标准下新能源汽车制造的综合解决服务商’，迎接未来崭新的十年。” 哪吒汽车泰国子公司总经理孙宝龙分享了哪吒汽车2025年泰国市场的经营策略，提出10000台+的零售目标和泰国新能源(2.590, 0.00, 0.00%)销量排名Top2，同时回应了经销商及客户关心的备件供应、X车型的保障等关切事项，给出了明确的解决时间表。另外，孙宝龙作为签约人代表哪吒汽车与金融、售后、生产领域的合作伙伴签署了四项重要战略协议。 在生产合作方面，哪吒汽车与泰国当地代工企业BGAC签署协议。BGAC将在未来5年持续为哪吒汽车提供生产支持，并计划于今年7月启动第2款车型——哪吒X的本地化生产；金融方面，哪吒汽车将与NLTH（泰国）金融在批发与零售业务上展开全面合作，并获得后者100亿泰铢（约21.5亿元人民币）的额度；另外，哪吒汽车与香港索罗科技签署备件供应链金融支持框架协议，保障售后服务水平，为其备件金融提供5亿泰铢（约1亿元人民币）的资金支持；售后维修层面，哪吒汽车与KINTAI景泰汽车工业签署电池整备中心合作框架协议强化电池维修核心能力，其将在泰国建立3个业务辐射全国的电池整备中心。 .appendQr_normal 海量资讯、精准解读，尽在新浪财经APP 责任SF014",2025-03-21 16:04:24.678285
App故障致车主无法开门 长城汽车因服务器异常致歉,2025年03月21日 15:55,新浪科技,"新浪科技讯 3月21日午间消息，今日上午，有多位车主反映，长城汽车(26.350, -1.17, -4.25%)旗下多个App出现故障，长城汽车App、哈弗智家App、坦克App都崩了，蓝牙钥匙车主无法开门。故障出现后，不少车主在长城汽车官方微博以及长城汽车董事长魏建军微博下留言。 长城汽车APP团队发布《致歉信》。信中提到，“由于云服务器通讯于2025年3月21日9：30突发异常，导致长城汽车APP以及旗下五品牌APP部分功能失效，出现了短暂的无法登录或正常使用的状况，对于故障给您带来的不便，我们深感愧疚与自责。问题发生后，技术团队第一时间联合云厂商展开全力修复工作，经过争分夺秒的努力，2025年3月21日10：30各APP均已恢复正常使用，若您此前登录受阻，现在可重启APP，或者更换网络环境后重新登录。” .appendQr_normal 海量资讯、精准解读，尽在新浪财经APP 责任SF014",2025-03-21 16:04:24.678285
土耳其主要股指下跌5% 触发熔断机制,2025年03月21日 15:54,环球市场播报,土耳其主要股指下跌5%，触发熔断机制。土耳其伊斯坦布尔证交所称，于格林尼治标准时间07：52暂时停止交易。 土耳其主要银行指数延续跌势，跌幅达8%。 .appendQr_normal 海量资讯、精准解读，尽在新浪财经APP 责任,2025-03-21 16:04:24.678285
是否期待美参议员戴恩斯访华为中美两国元首会晤奠定基础？外交部回应,2025年03月21日 15:52,,【环球时报-环球网报道 记者 索炎琦】外交部发言人毛宁主持3月21日例行记者会。会上有美媒记者提问称：你是否期待美国参议员戴恩斯访华为中美两国元首会晤奠定基础？ 毛宁对此表示，中方欢迎戴恩斯参议员访华，也欢迎包括国会议员在内的美国各界人士访华。中方一贯认为中美关系保持稳定健康可持续发展，符合两国人民的共同利益和国际社会的普遍期待。 .appendQr_normal 海量资讯、精准解读，尽在新浪财经APP 责任SF014,2025-03-21 16:04:24.678285
国泰君安期货：原油系抱团反弹！,2025年03月21日 15:47,市场资讯,". .hqimg_related .hqimg_related .hqimg_related .hqimg_related .to_page .hqimg_related .hqimg_related 热点栏目 自选股 数据中心 行情中心 资金流向 模拟交易 客户端 陈骏昊 国泰君安期货市场分析师 Z0021546 今天原油(607, -8.60, -1.40%)系抱团反弹！截止周五早盘收盘，原油05合约涨幅超过2%，燃油主力合约涨幅也在2%以上。沥青(3609, -13.00, -0.36%)、PX、PTA(5834, -4.00, -0.07%)、短纤等品种都出现了不同程度的反弹。那么这次原油系反弹的主要因素有哪些？原油价格方面有哪些驱动？点赞加关注，我们一起聊一聊。 本轮原油系的反弹主要原因在于原油供应端扰动，原油价格上涨带来的成本支撑。一方面，美国周四发布了对伊朗新的制裁，制裁对象包括亚洲一家独立炼油厂，以及向炼油厂供应原油的船只。伊朗作为全球重要的产油国，如果出口受限或将显著收紧市场供应。另一方面，OPEC+公布新减产方案，要求7个成员国进一步削减石油产量，来弥补超出协议产量的部分，此次减产幅度将超过 计划下个月开始执行的 月度增产幅度。 从供需角度来看，伊朗出口减少或将直接对供应端产生影响，而OPEC +的减产方案进一步强化了供应收缩的预期。但同时，我们需要注意美国经济前景存在较大不确定性，宏观驱动有待观察，此外 原油需求端的潜在波动 及全球能源转型的进展 对油价的长期影响 也值得关注。操作上近期可关注油价反弹幅度，追多需谨慎，注意价格反复风险。 本内容仅用于学习交流，不构成投资建议。接收本文不代表国泰君安期货与读者建立任何业务关系。本公司不对信息的准确性、完整性和可靠性提供保证，投资者须自行承担风险。本文观点仅为作者个人分析，不代表公司立场。未经书面授权，禁止任何形式的复制、修改或引用。如需转载，请注明出处为国泰君安期货，确保内容完整性，且不得对本点评进行有悖原意的引用、删节和修改。 .app-kaihu-qr .app-kaihu-qr 新浪合作平台国泰君安期货开户 安全快捷有保障 .appendQr_normal 海量资讯、精准解读，尽在新浪财经APP 责任",2025-03-21 16:04:24.678285
